{
  "$schema": "http://json-schema.org/draft-07/schema#",
  "title": "path agent-mode output envelope",
  "description": "Stable agent-mode JSON envelope produced by `rtlscanner path --json`. `path` finds a directional dataflow path from `--from` to `--to` by depth-first search over the same graph fanin/fanout traverse. `data.nodes` is the ordered node walk and `data.edges` the edges between them (nodes[i] --edges[i]--> nodes[i+1]). `--comb` restricts to a purely combinational path (never through a register). `found:false` with empty nodes/edges is a normal result (no such path), not an error.",
  "type": "object",
  "required": [
    "tool",
    "version",
    "status",
    "command",
    "data",
    "diagnostics",
    "errors",
    "summary"
  ],
  "properties": {
    "tool": {
      "type": "string",
      "const": "path"
    },
    "version": {
      "type": "string"
    },
    "status": {
      "type": "string",
      "enum": [
        "ok",
        "error"
      ]
    },
    "command": {
      "type": "object",
      "description": "Echo of the parsed argparse Namespace minus output flags."
    },
    "data": {
      "oneOf": [
        {
          "type": "object",
          "required": [
            "mode",
            "from",
            "to",
            "start",
            "end",
            "found",
            "nodes",
            "edges"
          ],
          "properties": {
            "mode": {
              "type": "string",
              "const": "path"
            },
            "from": {
              "type": "string",
              "description": "Resolved start signal name (the driver end of the path)."
            },
            "to": {
              "type": "string",
              "description": "Resolved end signal name (the loaded end)."
            },
            "from_scope": {
              "type": "string",
              "description": "Scope the start node was resolved in."
            },
            "to_scope": {
              "type": "string",
              "description": "Scope the end node was resolved in."
            },
            "from_type": {
              "type": "string",
              "description": "Start node data type."
            },
            "to_type": {
              "type": "string",
              "description": "End node data type."
            },
            "start": {
              "type": "string",
              "description": "Elaborated hierarchical path of the start node (== nodes[0] when found)."
            },
            "end": {
              "type": "string",
              "description": "Elaborated hierarchical path of the end node (== nodes[-1] when found)."
            },
            "found": {
              "type": "boolean",
              "description": "True when a path exists. False (an empty nodes/edges) is a normal result — the nodes are not connected in the from->to direction (or, with comb, only through a register) — not an error."
            },
            "length": {
              "type": "integer",
              "description": "Hop count (number of edges); 0 for a not-found or single-node (from == to) path."
            },
            "comb": {
              "type": "boolean",
              "description": "Present and true when --comb was used: the path is purely combinational and never traverses into a register node."
            },
            "nodes": {
              "type": "array",
              "items": {
                "type": "string"
              },
              "description": "Ordered node path start..end; nodes[i] --edges[i]--> nodes[i+1]."
            },
            "edges": {
              "type": "array",
              "items": {
                "type": "object",
                "required": [
                  "source",
                  "target",
                  "kind",
                  "description"
                ],
                "properties": {
                  "source": {
                    "type": "string"
                  },
                  "target": {
                    "type": "string"
                  },
                  "kind": {
                    "type": "string"
                  },
                  "description": {
                    "type": "string"
                  },
                  "source_type": {
                    "type": "string"
                  },
                  "target_type": {
                    "type": "string"
                  },
                  "source_bits": {
                    "type": "string",
                    "description": "Bit sub-range of the source that this edge reads ('[5]' / '[7:4]'); absent when the whole signal is read. Bit-level dataflow."
                  },
                  "target_bits": {
                    "type": "string",
                    "description": "Bit sub-range of the target that this edge drives; absent when the whole signal is driven. With source_bits, answers 'dout[5] comes from a[2]'."
                  },
                  "segments": {
                    "type": "array",
                    "items": {
                      "type": "object",
                      "properties": {
                        "source_bits": {
                          "type": "string"
                        },
                        "target_bits": {
                          "type": "string"
                        }
                      },
                      "required": [
                        "source_bits",
                        "target_bits"
                      ]
                    },
                    "description": "Per-bit permutation map for a copy whose offset varies (a bit reversal 'rev[i]=din[7-i]', a swap 'o={a[3:0],a[7:4]}') — a list of {source_bits, target_bits} sub-copies, e.g. 'din[7] -> rev[0]'. Present only for such a permutation; single-offset and whole-signal edges omit it (source_bits/target_bits then carry the map)."
                  },
                  "file": {
                    "type": "string"
                  },
                  "line": {
                    "type": "integer"
                  },
                  "depth": {
                    "type": "integer"
                  },
                  "clocked": {
                    "type": "boolean",
                    "description": "Present and true when the edge is registered (its target is driven by an edge-triggered always_ff / latch / edge-sensitive always) — i.e. a flip-flop boundary; absent for combinational edges (continuous assign, always_comb, port connection)."
                  }
                },
                "additionalProperties": true
              },
              "description": "Ordered dataflow edges between the nodes; len == len(nodes)-1. Same edge shape as fanin/fanout (source/target/kind/description/bits/location, plus clocked on a registered edge)."
            }
          },
          "additionalProperties": true
        },
        {
          "type": "null"
        }
      ]
    },
    "diagnostics": {
      "type": "array",
      "items": {
        "type": "object",
        "required": [
          "severity",
          "file",
          "line",
          "col",
          "message"
        ],
        "properties": {
          "severity": {
            "type": "string",
            "enum": [
              "error",
              "warning",
              "note",
              "info"
            ]
          },
          "file": {
            "type": "string"
          },
          "line": {
            "type": "integer",
            "minimum": 0
          },
          "col": {
            "type": "integer",
            "minimum": 0
          },
          "message": {
            "type": "string"
          }
        },
        "additionalProperties": false
      }
    },
    "errors": {
      "type": "array",
      "items": {
        "type": "object",
        "required": [
          "code",
          "message"
        ],
        "properties": {
          "code": {
            "type": "string",
            "enum": [
              "INPUT_NOT_FOUND",
              "BAD_FILELIST",
              "COMPILE_FAILED",
              "SCOPE_NOT_FOUND",
              "SIGNAL_NOT_FOUND",
              "BAD_CONFIG",
              "NO_TOP",
              "INTERNAL_ERROR"
            ]
          },
          "message": {
            "type": "string"
          },
          "details": {
            "type": "object",
            "description": "Machine-readable recovery hints. For SCOPE_NOT_FOUND: valid_prefix, failing_component, close_matches, children. For SIGNAL_NOT_FOUND: close_matches, available."
          }
        },
        "additionalProperties": false
      }
    },
    "summary": {
      "oneOf": [
        {
          "type": "object",
          "required": [
            "mode",
            "found"
          ],
          "properties": {
            "mode": {
              "type": "string"
            },
            "found": {
              "type": "boolean"
            },
            "length": {
              "type": "integer"
            },
            "nodes": {
              "type": "integer"
            },
            "edges": {
              "type": "integer"
            },
            "comb": {
              "type": "boolean"
            },
            "truncated": {
              "type": "boolean",
              "description": "True when an emitted list was capped by --limit; the count fields still report the true totals."
            },
            "limit": {
              "type": "integer",
              "description": "Effective per-list item cap that was applied (0 means unlimited)."
            }
          }
        },
        {
          "type": "null"
        }
      ]
    }
  },
  "additionalProperties": false
}
